{
  "$schema": "http://json-schema.org/draft-07/schema#",
  "title": "Design lens translation",
  "type": "object",
  "additionalProperties": false,
  "required": ["title", "summary", "reviewStatus", "sourceVersion"],
  "properties": {
    "title": { "type": "string", "minLength": 1 },
    "summary": { "type": "string", "minLength": 1 },
    "reviewStatus": { "enum": ["needs-review", "reviewed"] },
    "sourceVersion": { "type": "integer", "minimum": 1 }
  }
}
