{
  "title": "Ритм сложности",
  "summary": "Воспринимаемая сложность меняется между волнами и фазами. Стройте пики и облегчение так, чтобы игрок замечал свой рост, предвидел финал и ощущал растущую уверенность вместо непрерывной беспомощности.",
  "reviewStatus": "needs-review",
  "sourceVersion": 1
}
