{
  "title": "Цель встречи",
  "summary": "Выделяющееся испытание оправдывает своё место, когда решает хотя бы одну ясную задачу: награждает за упорство, удивляет, углубляет эмоциональный контекст либо проверяет и развивает навыки. Сначала назовите эту задачу, потом добавляйте зрелищность и сложность.",
  "reviewStatus": "needs-review",
  "sourceVersion": 1
}
