{
  "title": "Riesgo y recompensa",
  "summary": "Una elección cobra sentido cuando su posible beneficio se equilibra con un coste, peligro, incertidumbre o una oportunidad perdida. Ajusta ambos lados del intercambio y comunícalos antes del compromiso.",
  "reviewStatus": "needs-review",
  "sourceVersion": 2
}
