{
  "title": "Marco dramático",
  "summary": "La anticipación antes de un reto y su reconocimiento posterior convierten un obstáculo aislado en un acontecimiento significativo. Usa entrada, pausa, resultado y consecuencia para unir juego y narrativa.",
  "reviewStatus": "needs-review",
  "sourceVersion": 1
}
