{
  "title": "Context and sequence",
  "summary": "A challenge gains meaning from where it appears, how it fits its environment, and what earlier or later challenges prepare. Review timing, local systems, escalation, and aftermath together.",
  "reviewStatus": "needs-review",
  "sourceVersion": 1
}
