{
  "title": "هدف المواجهة",
  "summary": "يستحق التحدي البارز مكانه عندما يؤدي وظيفة واضحة واحدة على الأقل: مكافأة المثابرة، أو إثارة الدهشة، أو تعميق السياق العاطفي، أو اختبار المهارات وتوسيعها. حدّد الوظيفة قبل إضافة الاستعراض أو الصعوبة.",
  "reviewStatus": "needs-review",
  "sourceVersion": 1
}
